{
    "long_form": "(PEA)2PbI4",
    "short_form": "(PEA)PbI",
    "composition_estimate": "Estimated from precursor solutions",
    "sample_type": "Polycrystalline film",
    "dimensionality": "2D",
    "bandgap": 2.38,
    "a_ions": [
        {
            "abbreviation": "PEA",
            "coefficient": "2",
            "molecular_formula": "C8H12N+",
            "smile": "C1=CC=C(C=C1)CC[NH3+]",
            "common_name": "Phenylethylammonium",
            "iupac_name": "2-phenylethylazanium",
            "source_compound_smile": "C1=CC=C(C=C1)CCN",
            "source_compound_iupac_name": "2-phenylethanamine",
            "source_compound_cas_number": "64-04-0"
        }
    ],
    "b_ions": [
        {
            "abbreviation": "Pb",
            "coefficient": "1",
            "molecular_formula": "Pb2+",
            "smile": "[Pb+2]",
            "common_name": "Lead",
            "iupac_name": "lead(2+)",
            "cas_number": "14280-50-3",
            "source_compound_smile": "[Pb]",
            "source_compound_iupac_name": "Lead",
            "source_compound_cas_number": "7439-92-1"
        }
    ],
    "x_ions": [
        {
            "abbreviation": "I",
            "coefficient": "4",
            "molecular_formula": "I-",
            "smile": "[I-]",
            "common_name": "Iodide",
            "iupac_name": "Iodide",
            "cas_number": "20461-54-5",
            "source_compound_smile": "II",
            "source_compound_iupac_name": "molecular iodine",
            "source_compound_cas_number": "7553-56-2"
        }
    ],
    "additives_and_impurities": [
        {
            "function": "Additive",
            "abbreviation": "RbI",
            "concentration": 0.1,
            "concentration_metric": "wt %",
            "molecular_formula": "RbI",
            "smile": "[Rb+].[I-]",
            "common_name": "Rubidium iodide",
            "iupac_name": "rubidium(1+);iodide",
            "cas_number": "7790-29-6"
        },
        {
            "function": "Impurity",
            "abbreviation": "Fe2+",
            "concentration": 0.001,
            "concentration_metric": "mol %",
            "molecular_formula": "Fe2+",
            "smile": "[Fe+2]",
            "common_name": "Iron(2+)",
            "iupac_name": "iron(2+)",
            "cas_number": "1317-63-1"
        }
    ]
}